{
  "run_id": "VAL-05-JPM-RESIDUAL-INCOME-2026-02-13",
  "issuer_id": "sec-cik-0000019617",
  "security_id": "JPM:NYSE:COMMON",
  "as_of_date": "2026-02-13",
  "reporting_currency": "USD",
  "method": "residual_income",
  "base_scenario": "base",
  "scenarios": ["base"],
  "periods": [
    {"id": "FY2026", "kind": "forecast", "date": "2026-12-31"},
    {"id": "FY2027", "kind": "forecast", "date": "2027-12-31"}
  ],
  "conventions": {
    "timing": "year_end",
    "terminal": "continuing_residual_income"
  },
  "diluted_shares": {
    "value": 2696.2,
    "unit": "shares",
    "value_kind": "non_monetary",
    "currency": null,
    "date": "2026-02-13",
    "evidence_class": "estimated",
    "claim_basis": "target_security",
    "scenario": "base",
    "source_ref": "jpm-2025-10-k:period-end-common-shares; model-lock:unchanged-through-cutoff-bridge"
  },
  "inputs": {
    "beginning_book_fy2026": {
      "value": 342393,
      "unit": "currency",
      "value_kind": "monetary",
      "currency": "USD",
      "period": "FY2026",
      "evidence_class": "estimated",
      "claim_basis": "common_equity",
      "scenario": "base",
      "source_ref": "jpm-2025-10-k:common-stockholders-equity; model-lock:unchanged-through-cutoff-bridge"
    },
    "required_return_fy2026": {
      "value": 0.10,
      "unit": "ratio",
      "value_kind": "non_monetary",
      "currency": null,
      "period": "FY2026",
      "evidence_class": "assumed",
      "claim_basis": "common_equity",
      "scenario": "base",
      "source_ref": "model-lock:jpm-cost-of-common-equity"
    },
    "net_income_fy2026": {
      "value": 56000,
      "unit": "currency",
      "value_kind": "monetary",
      "currency": "USD",
      "period": "FY2026",
      "evidence_class": "assumed",
      "claim_basis": "common_equity",
      "scenario": "base",
      "source_ref": "model-lock:jpm-fy2026-common-net-income"
    },
    "dividends_fy2026": {
      "value": 17000,
      "unit": "currency",
      "value_kind": "monetary",
      "currency": "USD",
      "period": "FY2026",
      "evidence_class": "assumed",
      "claim_basis": "common_equity",
      "scenario": "base",
      "source_ref": "model-lock:jpm-fy2026-common-dividends"
    },
    "clean_surplus_adjustment_fy2026": {
      "value": -30000,
      "unit": "currency",
      "value_kind": "monetary",
      "currency": "USD",
      "period": "FY2026",
      "evidence_class": "assumed",
      "claim_basis": "common_equity",
      "scenario": "base",
      "source_ref": "model-lock:jpm-fy2026-net-repurchase-and-other-direct-equity-adjustment"
    },
    "required_return_fy2027": {
      "value": 0.10,
      "unit": "ratio",
      "value_kind": "non_monetary",
      "currency": null,
      "period": "FY2027",
      "evidence_class": "assumed",
      "claim_basis": "common_equity",
      "scenario": "base",
      "source_ref": "model-lock:jpm-cost-of-common-equity"
    },
    "roe_fy2027": {
      "value": 0.15,
      "unit": "ratio",
      "value_kind": "non_monetary",
      "currency": null,
      "period": "FY2027",
      "evidence_class": "assumed",
      "claim_basis": "common_equity",
      "scenario": "base",
      "source_ref": "model-lock:jpm-fy2027-roe"
    },
    "dividends_fy2027": {
      "value": 18000,
      "unit": "currency",
      "value_kind": "monetary",
      "currency": "USD",
      "period": "FY2027",
      "evidence_class": "assumed",
      "claim_basis": "common_equity",
      "scenario": "base",
      "source_ref": "model-lock:jpm-fy2027-common-dividends"
    },
    "clean_surplus_adjustment_fy2027": {
      "value": -25000,
      "unit": "currency",
      "value_kind": "monetary",
      "currency": "USD",
      "period": "FY2027",
      "evidence_class": "assumed",
      "claim_basis": "common_equity",
      "scenario": "base",
      "source_ref": "model-lock:jpm-fy2027-net-repurchase-and-other-direct-equity-adjustment"
    },
    "terminal_required_return": {
      "value": 0.10,
      "unit": "ratio",
      "value_kind": "non_monetary",
      "currency": null,
      "date": "2027-12-31",
      "evidence_class": "assumed",
      "claim_basis": "common_equity",
      "scenario": "base",
      "source_ref": "model-lock:jpm-terminal-required-return"
    },
    "terminal_roe": {
      "value": 0.12,
      "unit": "ratio",
      "value_kind": "non_monetary",
      "currency": null,
      "date": "2027-12-31",
      "evidence_class": "assumed",
      "claim_basis": "common_equity",
      "scenario": "base",
      "source_ref": "model-lock:jpm-terminal-roe"
    },
    "terminal_growth": {
      "value": 0.03,
      "unit": "ratio",
      "value_kind": "non_monetary",
      "currency": null,
      "date": "2027-12-31",
      "evidence_class": "assumed",
      "claim_basis": "common_equity",
      "scenario": "base",
      "source_ref": "model-lock:jpm-terminal-growth"
    }
  },
  "residual_income": {
    "forecast_periods": [
      {
        "period": "FY2026",
        "realization_date": "2026-12-31",
        "branch": "direct_net_income",
        "beginning_book_value_input": "beginning_book_fy2026",
        "net_income_input": "net_income_fy2026",
        "required_return_input": "required_return_fy2026",
        "dividends_input": "dividends_fy2026",
        "clean_surplus_adjustment_inputs": ["clean_surplus_adjustment_fy2026"]
      },
      {
        "period": "FY2027",
        "realization_date": "2027-12-31",
        "branch": "roe_derived",
        "roe_input": "roe_fy2027",
        "required_return_input": "required_return_fy2027",
        "dividends_input": "dividends_fy2027",
        "clean_surplus_adjustment_inputs": ["clean_surplus_adjustment_fy2027"]
      }
    ],
    "terminal": {
      "terminal_date": "2027-12-31",
      "required_return_input": "terminal_required_return",
      "roe_input": "terminal_roe",
      "growth_rate_input": "terminal_growth"
    }
  }
}
